{
  "corpus_sha256": "ef01b7f911b8457a8449a136621a9deb1868d79adf01e6e4426bc68ceecf9c9d",
  "corpus_summary": "45 еженедельных выпусков CHINT Russia за 23.06.2025–15.06.2026. Выпуск объединяет отраслевые новости энергетики и технологий, российско-китайскую повестку и иногда легкий человеческий или необычный сюжет.",
  "topic_priorities": [
    "Энергетика, электрические сети, генерация, накопители и электротехническая инфраструктура — максимальный приоритет.",
    "ЦОД, энергоснабжение вычислительной инфраструктуры и эффективность дата-центров — максимальный приоритет.",
    "ИИ, робототехника, микроэлектроника, цифровизация и прикладные современные технологии — высокий приоритет.",
    "Россия, Китай и особенно совместные проекты, торговля, наука и инфраструктура — высокий приоритет.",
    "Космос, транспорт, материалы и промышленность допустимы при наличии технологического угла.",
    "Необычный человеческий сюжет допустим как финальная разрядка, но не обязателен и не должен вытеснять сильную отраслевую новость."
  ],
  "issue_structure": [
    "Короткий заголовок без точки.",
    "Обычно четыре новости в опубликованном выпуске; в рабочей версии требуется восемь для редакционного выбора.",
    "Каждая новость начинается с синего круглого маркера 🔵 и занимает один абзац.",
    "Сначала сильные корпоративные, энергетические или инфраструктурные сюжеты, затем технологии и более легкие темы.",
    "В конце отдельной строкой #CHINT_Новости."
  ],
  "tone": [
    "Уверенный, живой, компактный и понятный неспециалисту.",
    "Факты важнее оценки; допустима одна образная финальная фраза.",
    "Технологический оптимизм без рекламного восторга и без тяжеловесного канцелярита.",
    "Короткие предложения, активный залог, умеренная разговорность.",
    "Числа и конкретные масштабы приветствуются, если они есть в источнике."
  ],
  "story_rules": [
    "Начинать с главного субъекта и действия: кто что запустил, построил, разработал или изменил.",
    "Обычно 2–3 предложения и 25–55 слов; одна мысль на предложение.",
    "Расшифровывать значение события через практический эффект, не повторяя заголовок источника.",
    "Сохранять официальные названия компаний, проектов, единицы измерения и числовые значения.",
    "Не вставлять источник внутрь текста поста: ссылка идет в редакционной подписи Word-документа."
  ],
  "headline_rules": [
    "Стремиться к 2–7 словам; длинный заголовок допустим, если он строится на ярком сопоставлении.",
    "Использовать устойчивые выражения и их технологическое переосмысление: «Дело техники», «Энергия набирает высоту», «Будущее жмет на газ».",
    "Объединять две крайние темы конструкцией «От X до Y» или перечислением с неожиданным последним элементом.",
    "Использовать лексику движения, энергии, масштаба и связей: обороты, рост, маршруты, мосты, высота, интеллект.",
    "Не ставить точку; восклицательный знак использовать только для органичной игры слов."
  ],
  "fact_rules": [
    "Не добавлять причинно-следственные связи, которых нет в источнике.",
    "Не переносить в текст неподтвержденные прогнозы как свершившиеся факты.",
    "Каждый сюжет должен сохранять ссылку, источник и дату для проверки редактором.",
    "При нехватке данных сокращать формулировку, а не заполнять пробел догадкой."
  ],
  "avoid": [
    "Кликбейт, сенсационность и обещания, не подтвержденные новостью.",
    "Длинные вводные конструкции, пассивный залог и бюрократические обороты.",
    "Повтор одного и того же слова или темы в большинстве сюжетов выпуска.",
    "Насмешки над людьми, политические оценки и спорные геополитические выводы.",
    "Непроверенные корпоративные новости CHINT и рекламные утверждения без публичного источника."
  ],
  "headline_examples": [
    "Где тонко — там технологии",
    "На экспорт — всё: знания, ватты, Репин",
    "Восток не сбавляет обороты",
    "Энергия дата-центров и котов",
    "Будущее жмет на газ",
    "Технологии против январской хандры",
    "Инновации полной прожарки",
    "Беги, робот, беги!",
    "Дело техники",
    "Энергия набирает высоту",
    "Инфраструктура с интеллектом"
  ]
}

